{
  "schema_version": "source-note-boundary-review-transition.v1",
  "transition_id": "issue-1609-boundary-1327-review-1",
  "repository": "liqiangcc/interview-lab",
  "issue_number": 1327,
  "source_note_id": "xhs-note:68c8f26a000000000e027051",
  "expected_body_sha256": "bc51965d3b21473a351ccf1aceeee8afb359f506410fbdf8fc8189cf046b966e",
  "expected_boundary_status": "pending",
  "expected_source_revision_id": "xhs-note:68c8f26a000000000e027051:snapshot-95b77bb26104",
  "expected_manifest_sha256": null,
  "expected_source_repository_ref": "95b77bb261048059846273688e4b90a2e108b437",
  "decision": "single-interview",
  "reviewed_at": "2026-09-08T00:00:00.000Z",
  "reviewer_kind": "ai-assisted",
  "review_evidence": {
    "repository": "liqiangcc/interview-lab",
    "issue_number": 1327,
    "comment_id": 1609001327
  },
  "checks": [
    {
      "check_id": "source_identity",
      "result": "pass",
      "note": "SourceNote identity matches the live machine record."
    },
    {
      "check_id": "source_revision_binding",
      "result": "pass",
      "note": "SourceRevision and source repository ref match the frozen snapshot."
    },
    {
      "check_id": "source_content_coverage",
      "result": "pass",
      "note": "The cited Raw or source_projection artifact is exact and hash-verified."
    },
    {
      "check_id": "event_boundary",
      "result": "pass",
      "note": "The disposition is supported by the cited source evidence. Exact Source records one completed, bounded candidate interview process with structured event/question evidence; rounds within the same process remain one case."
    },
    {
      "check_id": "no_cross_source_mixing",
      "result": "pass",
      "note": "This item cites only evidence belonging to this SourceNote."
    },
    {
      "check_id": "no_fabrication",
      "result": "pass",
      "note": "No Raw, Derived, or InterviewNote content is invented or overwritten."
    }
  ],
  "limitations": [
    "Exact Source records one completed, bounded candidate interview process with structured event/question evidence; rounds within the same process remain one case.",
    "Candidate only: review_evidence.comment_id is a deterministic placeholder; no live evidence comment was created.",
    "No body PATCH, label write, or InterviewNote materialization was performed; controller authorization is required."
  ]
}
